[
  {
    "date": "June 24th, 2023",
    "slug": "real-time-media-collection-from-users-the-new-frontier-in-user-generated-content",
    "title": "Real-time Media Collection from Users: The New Frontier in User Generated Content",
    "author": "Simon Peter Damian",
    "duration": "3 minutes read",
    "cover": "featured.jpg"
  },
  {
    "date": "June 23rd, 2023",
    "slug": "the-new-floatcam-evolving-to-better-serve-you",
    "title": "The New floatcam: Evolving to Better Serve You",
    "author": "Simon Peter Damian",
    "duration": "3 minutes read",
    "cover": "featured.jpg"
  }
]
